{
  "schemaVersion": 1,
  "versionLabel": "26.1.2",
  "officialJvmName": "net.minecraft.client.model.animal.llama.LlamaModel",
  "profile": "named_jar_26.1.2",
  "jarPath": "net/minecraft/client/model/animal/llama/LlamaModel.class",
  "classSha256Hex": "98b0510ed7df4a3e815489037a2012e3540c90f0f7646855660c4dc5cdd8d986",
  "renderStateType": "net.minecraft.client.renderer.entity.state.LlamaRenderState",
  "setupAnimMethod": "setupAnim",
  "inheritsSetupAnimFrom": "net.minecraft.client.model.EntityModel",
  "superSetupAnimCall": true,
  "assignments": [
    {
      "partField": "head",
      "property": "xRot",
      "expr": {
        "op": "mul",
        "args": [
          {
            "state": "xRot"
          },
          {
            "const": 0.017453292
          }
        ]
      }
    },
    {
      "partField": "head",
      "property": "yRot",
      "expr": {
        "op": "mul",
        "args": [
          {
            "state": "yRot"
          },
          {
            "const": 0.017453292
          }
        ]
      }
    },
    {
      "partField": "rightHindLeg",
      "property": "xRot",
      "expr": {
        "op": "mul",
        "args": [
          {
            "op": "mul",
            "args": [
              {
                "op": "cos",
                "args": [
                  {
                    "op": "mul",
                    "args": [
                      {
                        "state": "walkAnimationPos"
                      },
                      {
                        "const": 0.6662
                      }
                    ]
                  }
                ]
              },
              {
                "const": 1.4
              }
            ]
          },
          {
            "state": "walkAnimationSpeed"
          }
        ]
      }
    },
    {
      "partField": "leftHindLeg",
      "property": "xRot",
      "expr": {
        "op": "mul",
        "args": [
          {
            "op": "mul",
            "args": [
              {
                "op": "cos",
                "args": [
                  {
                    "op": "add",
                    "args": [
                      {
                        "op": "mul",
                        "args": [
                          {
                            "state": "walkAnimationPos"
                          },
                          {
                            "const": 0.6662
                          }
                        ]
                      },
                      {
                        "const": 3.1415927
                      }
                    ]
                  }
                ]
              },
              {
                "const": 1.4
              }
            ]
          },
          {
            "state": "walkAnimationSpeed"
          }
        ]
      }
    },
    {
      "partField": "rightFrontLeg",
      "property": "xRot",
      "expr": {
        "op": "mul",
        "args": [
          {
            "op": "mul",
            "args": [
              {
                "op": "cos",
                "args": [
                  {
                    "op": "add",
                    "args": [
                      {
                        "op": "mul",
                        "args": [
                          {
                            "state": "walkAnimationPos"
                          },
                          {
                            "const": 0.6662
                          }
                        ]
                      },
                      {
                        "const": 3.1415927
                      }
                    ]
                  }
                ]
              },
              {
                "const": 1.4
              }
            ]
          },
          {
            "state": "walkAnimationSpeed"
          }
        ]
      }
    },
    {
      "partField": "leftFrontLeg",
      "property": "xRot",
      "expr": {
        "op": "mul",
        "args": [
          {
            "op": "mul",
            "args": [
              {
                "op": "cos",
                "args": [
                  {
                    "op": "mul",
                    "args": [
                      {
                        "state": "walkAnimationPos"
                      },
                      {
                        "const": 0.6662
                      }
                    ]
                  }
                ]
              },
              {
                "const": 1.4
              }
            ]
          },
          {
            "state": "walkAnimationSpeed"
          }
        ]
      }
    }
  ],
  "extractionStatus": "ok",
  "extractionNotes": [
    "Visible assignment at line 80 not lifted.",
    "Visible assignment at line 85 not lifted.",
    "SetupAnim IR lifted from javap setupAnim (named_jar_26.1.2)."
  ]
}