{
  "schemaVersion": 1,
  "versionLabel": "26.1.2",
  "officialJvmName": "net.minecraft.client.model.animal.panda.BabyPandaModel",
  "profile": "named_jar_26.1.2",
  "jarPath": "net/minecraft/client/model/animal/panda/BabyPandaModel.class",
  "classSha256Hex": "269e362f2f9a611768fe3b015cf850b5bb6df5592e811510539f903123faab85",
  "inheritsSetupAnimFrom": "net.minecraft.client.model.QuadrupedModel",
  "assignments": [],
  "setupAnimMethod": "setupAnim",
  "extractionStatus": "ok",
  "extractionNotes": [
    "No local setupAnim body; inherits procedural rules from net.minecraft.client.model.QuadrupedModel.",
    "SetupAnim IR lifted from javap setupAnim (named_jar_26.1.2)."
  ]
}