{
  "schemaVersion": 1,
  "versionLabel": "26.1.2",
  "officialJvmName": "net.minecraft.client.model.animal.fox.FoxModel",
  "profile": "named_jar_26.1.2",
  "jarPath": "net/minecraft/client/model/animal/fox/FoxModel.class",
  "classSha256Hex": "e133e484f885b2744dcef5077e24306793187a98b1cf34a40a33f83283d62339",
  "renderStateType": "net.minecraft.client.renderer.entity.state.FoxRenderState",
  "setupAnimMethod": "setupAnim",
  "inheritsSetupAnimFrom": "net.minecraft.client.model.EntityModel",
  "superSetupAnimCall": true,
  "assignments": [
    {
      "partField": "head",
      "property": "xRot",
      "expr": {
        "op": "mul",
        "args": [
          {
            "state": "xRot"
          },
          {
            "const": 0.017453292
          }
        ]
      }
    },
    {
      "partField": "head",
      "property": "yRot",
      "expr": {
        "op": "mul",
        "args": [
          {
            "state": "yRot"
          },
          {
            "const": 0.017453292
          }
        ]
      }
    },
    {
      "partField": "head",
      "property": "xRot",
      "expr": {
        "const": 0
      }
    },
    {
      "partField": "head",
      "property": "yRot",
      "expr": {
        "const": -2.0943952
      }
    },
    {
      "partField": "head",
      "property": "zRot",
      "expr": {
        "op": "div",
        "args": [
          {
            "op": "cos",
            "args": [
              {
                "op": "mul",
                "args": [
                  {
                    "state": "ageInTicks"
                  },
                  {
                    "const": 0.027
                  }
                ]
              }
            ]
          },
          {
            "const": 22
          }
        ]
      }
    },
    {
      "partField": "rightHindLeg",
      "property": "xRot",
      "expr": {
        "op": "mul",
        "args": [
          {
            "op": "cos",
            "args": [
              {
                "const": 0.4662
              }
            ]
          },
          {
            "const": 0.1
          }
        ]
      }
    },
    {
      "partField": "leftHindLeg",
      "property": "xRot",
      "expr": {
        "op": "mul",
        "args": [
          {
            "op": "cos",
            "args": [
              {
                "op": "add",
                "args": [
                  {
                    "const": 0.4662
                  },
                  {
                    "const": 3.1415927
                  }
                ]
              }
            ]
          },
          {
            "const": 0.1
          }
        ]
      }
    },
    {
      "partField": "rightFrontLeg",
      "property": "xRot",
      "expr": {
        "op": "mul",
        "args": [
          {
            "op": "cos",
            "args": [
              {
                "op": "add",
                "args": [
                  {
                    "const": 0.4662
                  },
                  {
                    "const": 3.1415927
                  }
                ]
              }
            ]
          },
          {
            "const": 0.1
          }
        ]
      }
    },
    {
      "partField": "leftFrontLeg",
      "property": "xRot",
      "expr": {
        "op": "mul",
        "args": [
          {
            "op": "cos",
            "args": [
              {
                "const": 0.4662
              }
            ]
          },
          {
            "const": 0.1
          }
        ]
      }
    }
  ],
  "extractionStatus": "ok",
  "extractionNotes": [
    "SetupAnim IR lifted from javap setupAnim (named_jar_26.1.2)."
  ]
}