{
  "schemaVersion": 1,
  "versionLabel": "26.1.2",
  "officialJvmName": "net.minecraft.client.model.animal.cow.BabyCowModel",
  "profile": "named_jar_26.1.2",
  "jarPath": "net/minecraft/client/model/animal/cow/BabyCowModel.class",
  "classSha256Hex": "938885251f3aefac90bf8cc43276f725fa8c8ece8d70405c455fd56cdaed686c",
  "inheritsSetupAnimFrom": "net.minecraft.client.model.QuadrupedModel",
  "assignments": [],
  "setupAnimMethod": "setupAnim",
  "extractionStatus": "ok",
  "extractionNotes": [
    "No local setupAnim body; inherits procedural rules from net.minecraft.client.model.QuadrupedModel.",
    "SetupAnim IR lifted from javap setupAnim (named_jar_26.1.2)."
  ]
}