{
  "schemaVersion": 1,
  "versionLabel": "26.1.2",
  "officialJvmName": "net.minecraft.client.model.monster.piglin.ZombifiedPiglinModel",
  "profile": "named_jar_26.1.2",
  "jarPath": "net/minecraft/client/model/monster/piglin/ZombifiedPiglinModel.class",
  "classSha256Hex": "4b0d11836df1cabdd87fd2c89d27bc96a05efdb055704c2b5f79f596446dc71f",
  "inheritsSetupAnimFrom": "net.minecraft.client.model.monster.piglin.AbstractPiglinModel",
  "assignments": [],
  "setupAnimMethod": "setupAnim",
  "extractionStatus": "ok",
  "extractionNotes": [
    "No local setupAnim body; inherits procedural rules from net.minecraft.client.model.monster.piglin.AbstractPiglinModel.",
    "SetupAnim IR lifted from javap setupAnim (named_jar_26.1.2)."
  ]
}