{
  "schemaVersion": 1,
  "versionLabel": "26.1.2",
  "officialJvmName": "net.minecraft.client.model.animal.dolphin.DolphinModel",
  "profile": "named_jar_26.1.2",
  "jarPath": "net/minecraft/client/model/animal/dolphin/DolphinModel.class",
  "classSha256Hex": "0f01c866443d4a59fdb0b95bcce1aa3535704db7736ba2435991ad3e4b1bb5dc",
  "renderStateType": "net.minecraft.client.renderer.entity.state.DolphinRenderState",
  "setupAnimMethod": "setupAnim",
  "inheritsSetupAnimFrom": "net.minecraft.client.model.EntityModel",
  "superSetupAnimCall": true,
  "assignments": [
    {
      "partField": "body",
      "property": "xRot",
      "expr": {
        "op": "mul",
        "args": [
          {
            "state": "xRot"
          },
          {
            "const": 0.017453292
          }
        ]
      }
    },
    {
      "partField": "body",
      "property": "yRot",
      "expr": {
        "op": "mul",
        "args": [
          {
            "state": "yRot"
          },
          {
            "const": 0.017453292
          }
        ]
      }
    },
    {
      "partField": "body",
      "property": "xRot",
      "expr": {
        "op": "add",
        "args": [
          {
            "partSelf": "xRot"
          },
          {
            "op": "sub",
            "args": [
              {
                "const": -0.05
              },
              {
                "op": "mul",
                "args": [
                  {
                    "const": 0.05
                  },
                  {
                    "op": "cos",
                    "args": [
                      {
                        "op": "mul",
                        "args": [
                          {
                            "state": "ageInTicks"
                          },
                          {
                            "const": 0.3
                          }
                        ]
                      }
                    ]
                  }
                ]
              }
            ]
          }
        ]
      }
    },
    {
      "partField": "tail",
      "property": "xRot",
      "expr": {
        "op": "mul",
        "args": [
          {
            "const": -0.1
          },
          {
            "op": "cos",
            "args": [
              {
                "op": "mul",
                "args": [
                  {
                    "state": "ageInTicks"
                  },
                  {
                    "const": 0.3
                  }
                ]
              }
            ]
          }
        ]
      }
    },
    {
      "partField": "tailFin",
      "property": "xRot",
      "expr": {
        "op": "mul",
        "args": [
          {
            "const": -0.2
          },
          {
            "op": "cos",
            "args": [
              {
                "op": "mul",
                "args": [
                  {
                    "state": "ageInTicks"
                  },
                  {
                    "const": 0.3
                  }
                ]
              }
            ]
          }
        ]
      }
    }
  ],
  "extractionStatus": "ok",
  "extractionNotes": [
    "SetupAnim IR lifted from javap setupAnim (named_jar_26.1.2)."
  ]
}