{
  "schemaVersion": 1,
  "versionLabel": "26.1.2",
  "officialJvmName": "net.minecraft.client.model.animal.turtle.AdultTurtleModel",
  "profile": "named_jar_26.1.2",
  "jarPath": "net/minecraft/client/model/animal/turtle/AdultTurtleModel.class",
  "classSha256Hex": "e961cbd058ae8cd18525ef71cf1f943d77afa3921c8106974e049f537749ca36",
  "inheritsSetupAnimFrom": "net.minecraft.client.model.QuadrupedModel",
  "assignments": [],
  "setupAnimMethod": "setupAnim",
  "extractionStatus": "ok",
  "extractionNotes": [
    "No local setupAnim body; inherits procedural rules from net.minecraft.client.model.QuadrupedModel.",
    "SetupAnim IR lifted from javap setupAnim (named_jar_26.1.2)."
  ]
}