{
  "schemaVersion": 1,
  "versionLabel": "26.1.2",
  "officialJvmName": "net.minecraft.client.model.monster.strider.StriderModel",
  "profile": "named_jar_26.1.2",
  "jarPath": "net/minecraft/client/model/monster/strider/StriderModel.class",
  "classSha256Hex": "103f248f76d92cc88a627c313e9187116c21e68a747bf76bea8caccbac16810e",
  "renderStateType": "net.minecraft.client.renderer.entity.state.StriderRenderState",
  "setupAnimMethod": "setupAnim",
  "inheritsSetupAnimFrom": "net.minecraft.client.model.EntityModel",
  "superSetupAnimCall": true,
  "assignments": [
    {
      "partField": "body",
      "property": "xRot",
      "expr": {
        "op": "mul",
        "args": [
          {
            "state": "xRot"
          },
          {
            "const": 0.017453292
          }
        ]
      }
    },
    {
      "partField": "body",
      "property": "yRot",
      "expr": {
        "op": "mul",
        "args": [
          {
            "state": "yRot"
          },
          {
            "const": 0.017453292
          }
        ]
      }
    },
    {
      "partField": "body",
      "property": "xRot",
      "expr": {
        "const": 0
      }
    },
    {
      "partField": "body",
      "property": "yRot",
      "expr": {
        "const": 0
      }
    },
    {
      "partField": "body",
      "property": "zRot",
      "expr": {
        "op": "mul",
        "args": [
          {
            "op": "mul",
            "args": [
              {
                "op": "mul",
                "args": [
                  {
                    "const": 0.1
                  },
                  {
                    "op": "sin",
                    "args": [
                      {
                        "op": "mul",
                        "args": [
                          {
                            "state": "walkAnimationPos"
                          },
                          {
                            "const": 1.5
                          }
                        ]
                      }
                    ]
                  }
                ]
              },
              {
                "const": 4
              }
            ]
          },
          {
            "state": "walkAnimationSpeed"
          }
        ]
      }
    },
    {
      "partField": "leftLeg",
      "property": "xRot",
      "expr": {
        "op": "mul",
        "args": [
          {
            "op": "mul",
            "args": [
              {
                "op": "sin",
                "args": [
                  {
                    "op": "mul",
                    "args": [
                      {
                        "op": "mul",
                        "args": [
                          {
                            "state": "walkAnimationPos"
                          },
                          {
                            "const": 1.5
                          }
                        ]
                      },
                      {
                        "const": 0.5
                      }
                    ]
                  }
                ]
              },
              {
                "const": 2
              }
            ]
          },
          {
            "state": "walkAnimationSpeed"
          }
        ]
      }
    },
    {
      "partField": "rightLeg",
      "property": "xRot",
      "expr": {
        "op": "mul",
        "args": [
          {
            "op": "mul",
            "args": [
              {
                "op": "sin",
                "args": [
                  {
                    "op": "add",
                    "args": [
                      {
                        "op": "mul",
                        "args": [
                          {
                            "op": "mul",
                            "args": [
                              {
                                "state": "walkAnimationPos"
                              },
                              {
                                "const": 1.5
                              }
                            ]
                          },
                          {
                            "const": 0.5
                          }
                        ]
                      },
                      {
                        "const": 3.1415927
                      }
                    ]
                  }
                ]
              },
              {
                "const": 2
              }
            ]
          },
          {
            "state": "walkAnimationSpeed"
          }
        ]
      }
    },
    {
      "partField": "leftLeg",
      "property": "zRot",
      "expr": {
        "op": "mul",
        "args": [
          {
            "op": "mul",
            "args": [
              {
                "const": 0.17453292
              },
              {
                "op": "cos",
                "args": [
                  {
                    "op": "mul",
                    "args": [
                      {
                        "op": "mul",
                        "args": [
                          {
                            "state": "walkAnimationPos"
                          },
                          {
                            "const": 1.5
                          }
                        ]
                      },
                      {
                        "const": 0.5
                      }
                    ]
                  }
                ]
              }
            ]
          },
          {
            "state": "walkAnimationSpeed"
          }
        ]
      }
    },
    {
      "partField": "rightLeg",
      "property": "zRot",
      "expr": {
        "op": "mul",
        "args": [
          {
            "op": "mul",
            "args": [
              {
                "const": 0.17453292
              },
              {
                "op": "cos",
                "args": [
                  {
                    "op": "add",
                    "args": [
                      {
                        "op": "mul",
                        "args": [
                          {
                            "op": "mul",
                            "args": [
                              {
                                "state": "walkAnimationPos"
                              },
                              {
                                "const": 1.5
                              }
                            ]
                          },
                          {
                            "const": 0.5
                          }
                        ]
                      },
                      {
                        "const": 3.1415927
                      }
                    ]
                  }
                ]
              }
            ]
          },
          {
            "state": "walkAnimationSpeed"
          }
        ]
      }
    }
  ],
  "extractionStatus": "ok",
  "extractionNotes": [
    "SetupAnim IR lifted from javap setupAnim (named_jar_26.1.2)."
  ]
}